{
  "$schema": "https://json-schema.org/draft/2020-12/schema",
  "additionalProperties": false,
  "description": "KindDefinition is a hand-authored kind.json — the source-side shape\n that `veil build` compiles into a published Kind (registry.proto).",
  "patternProperties": {
    "^(forwardDependencies)$": {
      "default": false,
      "description": "Union with the per-edge flag — an edge forwards when either says\n so — and forwarding chains either way.",
      "title": "Whether every dependency a resource of this kind declares is\n forwarded to that resource's own consumers, as if each edge had set\n `forward: true`. A policy for the kind rather than a per-resource\n choice: a `package` that exists to bundle things up for whoever\n uses it sets this once, instead of every package resource\n repeating the flag on every edge.",
      "type": "boolean"
    }
  },
  "properties": {
    "forward_dependencies": {
      "default": false,
      "description": "Union with the per-edge flag — an edge forwards when either says\n so — and forwarding chains either way.",
      "title": "Whether every dependency a resource of this kind declares is\n forwarded to that resource's own consumers, as if each edge had set\n `forward: true`. A policy for the kind rather than a per-resource\n choice: a `package` that exists to bundle things up for whoever\n uses it sets this once, instead of every package resource\n repeating the flag on every edge.",
      "type": "boolean"
    },
    "hooks": {
      "additionalProperties": false,
      "description": "Hook code files grouped by lifecycle point. The dependents block —\n the per-consumer hooks that fire when another kind declares a\n dependency on this one — also lives under `hooks`, since it is\n ultimately just another hook lifecycle.",
      "patternProperties": {
        "^(postRender)$": {
          "description": "Post-render hooks that run after resource-level render hooks but\n before validate. Same `RenderHook(ctx, fs)` contract as the\n `render` lifecycle — mutating, declaration-ordered — but their\n job is the kind's final word on normalization: consistent\n formatting, key ordering, banner stamping, etc. Splitting this\n from `render` lets a kind react to whatever resource hooks\n produced (which the kind couldn't see at the `render` stage)\n without giving up the deterministic last-mile pass.",
          "items": {
            "title": "Value"
          },
          "type": "array"
        }
      },
      "properties": {
        "dependents": {
          "description": "Per-consumer dependent hooks. Each entry binds a consumer kind to\n hook(s) that run when a resource of that kind declares a\n dependency on this one, plus the params schema the consumer must\n supply. See SPEC.md \"Dependencies\" for the full design.",
          "items": {
            "additionalProperties": false,
            "description": "DependentDefinition declares a consumer kind that may depend on this\n kind, the hook file path(s) that run when such a dependency is\n rendered, and the JSON Schema describing the `params` the consumer\n must supply.",
            "patternProperties": {
              "^(paramsPath)$": {
                "description": "Local path (relative to kind.json) or HTTP(S) URL to the dependency\n params' JSON Schema.",
                "minLength": 1,
                "type": "string"
              }
            },
            "properties": {
              "kind": {
                "description": "The consumer kind that may depend on this resource.",
                "minLength": 1,
                "pattern": "^[a-z][a-z0-9_-]*$",
                "type": "string"
              },
              "params_path": {
                "description": "Local path (relative to kind.json) or HTTP(S) URL to the dependency\n params' JSON Schema.",
                "minLength": 1,
                "type": "string"
              },
              "paths": {
                "description": "Paths to hook files that run when a resource of `kind` declares a\n dependency on this resource. At least one entry is required. Hooks\n run in declaration order. Paths are resolved relative to the\n enclosing kind.json file.",
                "items": {
                  "minLength": 1,
                  "type": "string"
                },
                "minItems": 1,
                "type": "array"
              }
            },
            "required": [
              "kind",
              "params_path"
            ],
            "title": "Dependent Definition",
            "type": "object"
          },
          "type": "array"
        },
        "post_render": {
          "description": "Post-render hooks that run after resource-level render hooks but\n before validate. Same `RenderHook(ctx, fs)` contract as the\n `render` lifecycle — mutating, declaration-ordered — but their\n job is the kind's final word on normalization: consistent\n formatting, key ordering, banner stamping, etc. Splitting this\n from `render` lets a kind react to whatever resource hooks\n produced (which the kind couldn't see at the `render` stage)\n without giving up the deterministic last-mile pass.",
          "items": {
            "title": "Value"
          },
          "type": "array"
        },
        "render": {
          "description": "Hooks run during `veil render` (each exports a Hook whose optional\n `renderHook(ctx, fs)` transforms the bundle). See RenderHookDefinition\n for the full per-entry shape; a bare string is shorthand for\n `{path: \u003cstring\u003e}` with no `access` grants.",
          "items": {
            "title": "Value"
          },
          "type": "array"
        },
        "validate": {
          "description": "Validation hooks that run after every other lifecycle point\n (kind.render, dependents, resource-level render hooks, and\n post_render hooks) has completed. Each hook receives the same\n context + FS as render hooks but any mutations are discarded by\n the runner; the only observable output is the collection of\n `ValidationIssue` entries the hook returns (or throws). Every\n validate hook runs regardless of failures so the user sees every\n issue at once; the render fails at the end with an aggregated\n report if any issues are reported.",
          "items": {
            "title": "Value"
          },
          "type": "array"
        }
      },
      "title": "HooksDefinition groups a kind's hook files by lifecycle point. Each\n field is an ordered list; the order determines invocation order at\n that lifecycle point. Additional lifecycle points will be added as\n fields on this message so the kind.json shape can extend without\n breaking changes.",
      "type": "object"
    },
    "name": {
      "description": "The name of this kind (e.g. \"service\", \"cron\"). Must start with a\n lowercase letter and contain only lowercase letters, digits, `-`,\n and `_` — the same convention enforced by `veil new kind`.",
      "minLength": 1,
      "pattern": "^[a-z][a-z0-9_-]*$",
      "type": "string"
    },
    "schema": {
      "default": "",
      "description": "Local path or HTTP(S) URL to the spec's JSON Schema.",
      "type": "string"
    },
    "sources": {
      "description": "google.protobuf.Value so an entry can be a bare string path (no\n schema) or a SourceDefinition object (path + optional schema) —\n same polymorphism as `hooks`, same reason: protojson can't type\n \"string OR struct\". The build pipeline narrows each Value into a\n SourceDefinition at load time.",
      "items": {
        "title": "Value"
      },
      "title": "Source configuration files that make up the kind. May be empty.",
      "type": "array"
    },
    "variables": {
      "additionalProperties": {
        "additionalProperties": false,
        "description": "Variable declares a named input available to overlay regex matches\n (and to hooks via the render context). Lives in both the local\n VeilConfigDefinition and the published Kind (carried verbatim\n through compilation), so it has no Definition suffix — the same\n shape applies in both contexts.",
        "properties": {
          "default": {
            "description": "Optional default. If omitted, the variable is required at render time.\n Must be a scalar matching the declared type.",
            "title": "Value"
          },
          "description": {
            "description": "Optional human-readable description. Rendered as a JSDoc comment on\n the field in the generated veil-types.ts RegistryVariables interface\n so hook authors get inline documentation at their IDE cursor.",
            "type": "string"
          },
          "enum": {
            "description": "Optional set of permitted values. Only valid for `string` and `number`\n types. When present, the generated TypeScript field becomes a union\n (\"a\" | \"b\" | \"c\") instead of the broad scalar type, and values\n supplied via --var or VEIL_VAR_* are rejected at render time unless\n they match one of the listed entries.",
            "items": {
              "title": "Value"
            },
            "type": "array"
          },
          "type": {
            "description": "Declared type. Must be one of the legal VariableType.Enum values\n (the `unspecified` zero is rejected at load time).",
            "enum": [
              "unspecified",
              "string",
              "number",
              "bool"
            ],
            "title": "Enum",
            "type": "string"
          }
        },
        "title": "Variable",
        "type": "object"
      },
      "description": "Kind-scoped input variable declarations, keyed by name. Merged with\n the project-level variables from veil.json at config-load time;\n declaring a name that already exists in veil.json or in another\n kind is rejected. Otherwise the shape and resolution rules are\n identical to VeilConfigDefinition.variables.",
      "propertyNames": {
        "pattern": "^[a-zA-Z_][a-zA-Z0-9_]*$",
        "type": "string"
      },
      "type": "object"
    }
  },
  "required": [
    "name"
  ],
  "title": "Kind Definition",
  "type": "object"
}